{
  "$schema": "https://json-schema.org/draft/2020-12/schema",
  "title": "TasteProfile",
  "description": "Вкусовой профиль человека по анкетам «Вкусовой профиль», свайп-анкете (data/taste-deck.json) и разбору подбора в терминах каталога продуктов: оси вкуса, ноты аромата, кухни и id позиций из data/foods.json. При противоречии разбор подбора важнее анкеты, новая анкета — старой. Топ подбора строится только из позиций foods с оценкой от 0 и их близких вариантов; позиции, которых нет ни в foods, ни в untried, человеку незнакомы и идут только в отдельный список «попробовать».",
  "type": "object",
  "additionalProperties": false,
  "required": ["id", "name", "answered", "summary", "novelty", "diet", "taste", "aroma", "cuisines", "foods", "methods", "textures", "untried"],
  "properties": {
    "$schema": {
      "type": "string",
      "description": "Путь к схеме для подсказок в редакторе. На сайт не влияет."
    },
    "id": {
      "type": "string",
      "pattern": "^[a-z0-9]+(?:-[a-z0-9]+)*$",
      "description": "Совпадает с именем файла без .json."
    },
    "name": {
      "type": "string",
      "minLength": 2,
      "maxLength": 60,
      "description": "Имя из анкеты."
    },
    "answered": {
      "type": "string",
      "format": "date",
      "description": "Когда заполнена последняя анкета."
    },
    "summary": {
      "type": "string",
      "minLength": 40,
      "maxLength": 1500,
      "description": "Профиль словами: что любит и почему, чего избегает, противоречия между ответами, с чего начинать новое. Сюда же то, что не ложится в поля: прожарка, блюда без позиций в каталоге, оговорки свободных ответов."
    },
    "novelty": {
      "enum": ["familiar", "similar", "curious", "adventurous"],
      "description": "Отношение к новой еде: familiar — ест привычное; similar — попробует похожее на знакомое; curious — с удовольствием пробует новое; adventurous — ищет самое необычное. В свайп-анкете — по доле ♥ на своей кухне и классике против этники и редких кухонь."
    },
    "diet": {
      "type": "array",
      "uniqueItems": true,
      "description": "Ограничения. Пусто — нет. Ограничение из «Другое», которого нет в списке, — в foods и summary.",
      "items": {
        "enum": [
          "vegetarian",
          "vegan",
          "no-pork",
          "halal-kosher",
          "gluten-free",
          "lactose-free",
          "nut-allergy",
          "seafood-allergy",
          "calorie-conscious"
        ]
      }
    },
    "taste": {
      "type": "object",
      "additionalProperties": false,
      "required": ["sweet", "sweetSavory", "sour", "salty", "bitter", "umami", "heat", "fat"],
      "description": "Отношение к осям Taste каталога. liking: «Избегаю» — −2, «Немного — нормально» — 0, «Нравится» — 1, «Чем больше, тем лучше» — 2. max: «Избегаю» — 2, «Немного — нормально» — 5, «Нравится» — 8, «Чем больше, тем лучше» — 10.",
      "properties": {
        "sweet": { "$ref": "#/$defs/TastePreference", "description": "Сладость десертов, фруктов, ягод и напитков." },
        "sweetSavory": {
          "$ref": "#/$defs/TastePreference",
          "description": "Сладость в несладком: чернослив в мясе, мёд в заправке, ягодный соус к утке. Вместо sweet для позиций вне групп desserts, fruits, berries и drinks."
        },
        "sour": { "$ref": "#/$defs/TastePreference" },
        "salty": { "$ref": "#/$defs/TastePreference" },
        "bitter": { "$ref": "#/$defs/TastePreference" },
        "umami": { "$ref": "#/$defs/TastePreference" },
        "heat": {
          "$ref": "#/$defs/TastePreference",
          "description": "По шкале 0–10 из анкеты — она совпадает с осью heat каталога. liking: 0 — −2, 1–3 — 0, 4–6 — 1, 7–10 — 2; max — ответ плюс 1."
        },
        "fat": { "$ref": "#/$defs/TastePreference" }
      }
    },
    "aroma": {
      "$ref": "#/$defs/Likings",
      "description": "Ноты аромата каталога (ключи Aroma в foods.schema.json). Травы и специи — по своим нотам; продукт, который и есть нота (грибы — mushroom, оливки — olive), — тоже сюда, остальные продукты — в foods. Нота, ведущая в любимом блюде, но отмеченная «Не знаю этот вкус», — 1. Пара «что ближе» с нотой (укроп или кинза) — как в foods; противоречие с прямым ответом — 0 и в summary. Свайп-анкета: нота от 4 на карточках с тремя и больше ответами ♥ или ✕ — 1 или −1, если нравится заметно чаще или реже остальных карточек, как «Больше/меньше обычного» в приложении: |(♥ + 2·доля ♥) / (ответов + 2) − доля ♥| от 0,15; прежняя оценка того же знака остаётся, 0 сменяется, противоположная — 0 и в summary."
    },
    "cuisines": {
      "$ref": "#/$defs/Likings",
      "description": "Кухни каталога (Cuisine в foods.schema.json). Строка анкеты — на все кухни, которые она называет: «Тайская и вьетнамская» — thai и vietnamese. Кухня с ответом «Не пробовал(а)», но с оценённым блюдом, где она первая, — оценка лучшего такого блюда, не выше 1. Свайп-анкета — по первой кухне карточки, как в aroma."
    },
    "foods": {
      "$ref": "#/$defs/Likings",
      "description": "Позиции каталога по id: что человек ел, и то, чего есть не станет. Знакомые блюда: «Люблю» — 2, «Ем, нормально» — 0, «Не люблю» — −1. Новые блюда: «Ел(а), понравилось» — 1, «Ел(а), не понравилось» — −1. Ел за последние две недели — 1, берёт в ресторане — 2. Пары «что ближе»: выбранное и «оба нравятся» — 1, «ни то, ни другое» — −1 обоим. Строка — на все позиции, которые она называет, и на все формы одного блюда (сырое и готовое). Продукт «Не ем» в methods — −2 всем позициям, где он главный. Способ, который однозначно называет позицию (устрицы сырые, фуа-гра жареная), — 1; остальное из methods сюда не переносится: от способа не следует, что человек знает блюдо. Свайп-анкета: в счёт идут только основные фото в ресторанной подаче, домашние — строкой о подаче в summary. ♥ — 1, ✕ — −1 первой позиции карточки и всем её формам, «?» ничего не меняет; прежняя оценка того же знака остаётся, 0 сменяется, противоположная — 0 и в summary; позиция уходит из untried. Карточка, чьё фото противоречит оговорке из summary (стейк с кровью при medium well), оценок не меняет."
    },
    "methods": {
      "type": "object",
      "additionalProperties": false,
      "required": [
        "chicken",
        "duck",
        "beef",
        "pork",
        "lamb",
        "mince",
        "white-fish",
        "fatty-fish",
        "shrimp-squid",
        "mussels-oysters",
        "liver",
        "foie-gras",
        "offal",
        "eggs"
      ],
      "description": "В каком виде человек ест продукт с удовольствием: mince — фарш (котлеты, тефтели), white-fish — треска, судак, fatty-fish — лосось, скумбрия, сельдь, shrimp-squid — креветки и кальмары, mussels-oysters — мидии и устрицы, liver — печень говяжья и куриная, offal — язык, сердце, желудки. Пусто — не ест. Неотмеченный способ — слабый минус: оценка блюда в foods важнее (лосось запечённый «Люблю», хотя запечённое не отмечено).",
      "properties": {
        "chicken": { "$ref": "#/$defs/Ways" },
        "duck": { "$ref": "#/$defs/Ways" },
        "beef": { "$ref": "#/$defs/Ways" },
        "pork": { "$ref": "#/$defs/Ways" },
        "lamb": { "$ref": "#/$defs/Ways" },
        "mince": { "$ref": "#/$defs/Ways" },
        "white-fish": { "$ref": "#/$defs/Ways" },
        "fatty-fish": { "$ref": "#/$defs/Ways" },
        "shrimp-squid": { "$ref": "#/$defs/Ways" },
        "mussels-oysters": { "$ref": "#/$defs/Ways" },
        "liver": { "$ref": "#/$defs/Ways" },
        "foie-gras": { "$ref": "#/$defs/Ways" },
        "offal": { "$ref": "#/$defs/Ways" },
        "eggs": { "$ref": "#/$defs/Ways" }
      }
    },
    "textures": {
      "type": "array",
      "uniqueItems": true,
      "description": "Неприятные текстуры. Пусто — таких нет. jelly — желе и студень; slimy — слизистое (бамия, маслята, сырое яйцо); sticky — тягучее и липкое (моти, клейкий рис); rubbery — упругое (кальмар, осьминог); raw — сырая рыба и мясо; mushy — разваренные мягкие овощи; beads — крупинки и шарики (тапиока, чиа, икра); gristle — хрящи, кожа, жилки; chunks — кусочки в гладком.",
      "items": { "enum": ["jelly", "slimy", "sticky", "rubbery", "raw", "mushy", "beads", "gristle", "chunks"] }
    },
    "untried": {
      "type": "object",
      "additionalProperties": false,
      "required": ["aroma", "cuisines", "foods"],
      "description": "Не пробовал, не знает, что это, или не знает этот вкус — материал для списка «попробовать», не для топа. Оценённое в aroma, cuisines или foods сюда не входит.",
      "properties": {
        "aroma": { "$ref": "#/$defs/Interests" },
        "cuisines": { "$ref": "#/$defs/Interests" },
        "foods": { "$ref": "#/$defs/Interests" }
      }
    }
  },
  "$defs": {
    "Liking": {
      "type": "integer",
      "minimum": -2,
      "maximum": 2,
      "description": "−2 — не ест или больше не возьмёт («Не ем», «Избегаю»); −1 — не нравится; 0 — всё равно, ест в составе блюда; 1 — нравится; 2 — любит («Люблю», «Чем больше, тем лучше»)."
    },
    "Likings": {
      "type": "object",
      "propertyNames": { "pattern": "^[a-z0-9]+(?:-[a-z0-9]+)*$" },
      "additionalProperties": { "$ref": "#/$defs/Liking" }
    },
    "Interest": {
      "type": "integer",
      "minimum": -1,
      "maximum": 1,
      "description": "1 — «Не ел(а), попробовал(а) бы»; 0 — «Не пробовал(а)», «Не знаю, что это» без ответа об интересе; −1 — «Не ел(а), не тянет»."
    },
    "Interests": {
      "type": "object",
      "propertyNames": { "pattern": "^[a-z0-9]+(?:-[a-z0-9]+)*$" },
      "additionalProperties": { "$ref": "#/$defs/Interest" }
    },
    "Ways": {
      "type": "array",
      "uniqueItems": true,
      "items": {
        "enum": ["grilled", "deep-fried", "braised", "baked", "boiled", "cured", "raw"],
        "description": "grilled — жареное, гриль; deep-fried — во фритюре, в панировке; braised — тушёное, в соусе; baked — запечённое; boiled — варёное, в супе; cured — копчёное, солёное, вяленое; raw — сырое: тартар, суши, севиче."
      }
    },
    "TastePreference": {
      "type": "object",
      "additionalProperties": false,
      "required": ["liking", "max"],
      "properties": {
        "liking": { "$ref": "#/$defs/Liking", "description": "Насколько больше этого вкуса делает еду привлекательнее." },
        "max": {
          "type": "integer",
          "minimum": 0,
          "maximum": 10,
          "description": "Уровень оси каталога, выше которого уже слишком."
        }
      }
    }
  }
}
