{
  "$schema": "../../schemas/taste-profile.schema.json",
  "id": "vitaly",
  "name": "Виталий",
  "answered": "2026-10-30",
  "summary": "Любит сытное и привычное: котлеты с пюре, шашлык, бефстроганов, тартар, бургер, шаурму, хачапури, лазанью, пиццу и пасту; тяжёлое выбирает чаще лёгкого. Рис в любом виде: плов, ризотто, паэлья. Супы почти все: борщ, грибной, харчо, рамен, том ям. Рыбу ест запечённой, в кляре, солёной и в роллах (лосось, сельдь, шуба), отварную — нет. Курицу — гриль и во фритюре (крылышки, шаурма); в соусе (сливочном, чахохбили, тикка, карри) и запечённую не выбрал ни разу. Сладкое в мясе — барбекю и кисло-сладкая свинина, не ягоды и чернослив. Не любит бобовые (фалафель, дал, чили), зиру и тёплые пряности в мясе (мусака, таджин), левантийские салаты, печень и субпродукты (фуа-гра — только жареная), тыкву, тофу, сало, слизистое. Острое и кислое — до 7 в супах, но не в салатах и чили. Стейк — medium well: стейк с кровью на фото отклонил. Новое — если похоже на знакомое: из 12 карточек популярной этники выбрал 3. Многие блюда знает в адаптированном виде или под другими названиями: незнакомое — только отдельным списком. Дома ест просто, следит за калориями. Противоречия, оценка 0 до уточнения: сырники, гамбас, севиче (ответ за 0,4 с), холодец (на фото куриный), мусака, шакшука и курица в сливочном соусе в v1/v2 нравились, в свайпах — нет; солянку не любил, в свайпах выбрал; французскую кухню и чеснок любил, в свайпах 1 из 4 и 2 из 8. Кинза: v1 — нет, v2 — да, свайпы — 1 из 4. Утку с вишнёвым соусом любит, утиную грудку с ягодным соусом не выбрал. Рыбу на пару выбрал, хотя отварную не любит.",
  "novelty": "similar",
  "diet": [
    "calorie-conscious"
  ],
  "taste": {
    "sweet": {
      "liking": 1,
      "max": 8
    },
    "sweetSavory": {
      "liking": 2,
      "max": 10
    },
    "sour": {
      "liking": 0,
      "max": 5
    },
    "salty": {
      "liking": 0,
      "max": 5
    },
    "bitter": {
      "liking": 1,
      "max": 8
    },
    "umami": {
      "liking": 2,
      "max": 10
    },
    "heat": {
      "liking": 1,
      "max": 6
    },
    "fat": {
      "liking": 2,
      "max": 10
    }
  },
  "aroma": {
    "coconut": 0,
    "olive": 2,
    "dill": 1,
    "cilantro": -1,
    "mint": -1,
    "anise": -1,
    "warm-spice": -1,
    "cumin": -1,
    "curry": 0,
    "ginger": 1,
    "lemongrass": 1,
    "garlic": 0,
    "roasted": 2,
    "fried": 1,
    "smoky": 1,
    "caramel": 1,
    "chocolate": 1,
    "nutty": 1,
    "blue-mold": -1,
    "meaty": 1,
    "mushroom": 2,
    "cultured": 1,
    "cereal": 1,
    "bready": 1,
    "pickled": 1,
    "gamey": -1
  },
  "cuisines": {
    "russian": 2,
    "ukrainian": 2,
    "georgian": 0,
    "armenian": 0,
    "azerbaijani": 0,
    "central-asian": 0,
    "german": -1,
    "dutch": -1,
    "french": 0,
    "italian": 2,
    "spanish": 0,
    "portuguese": 0,
    "nordic": -1,
    "greek": 0,
    "turkish": 0,
    "levantine": -1,
    "persian": -1,
    "maghreb": 1,
    "indian": 0,
    "chinese": 1,
    "japanese": 2,
    "thai": 1,
    "vietnamese": 1,
    "american": 2,
    "mexican": 0,
    "peruvian": 0,
    "brazilian": 0,
    "argentinian": 0,
    "latin-american": 0
  },
  "foods": {
    "chicken-noodle-soup-noodles-separate": 0,
    "chicken-noodle-soup-with-noodles": 0,
    "borscht-no-potatoes": 2,
    "borscht-with-potatoes": 2,
    "shchi-fresh-cabbage-no-potatoes": -1,
    "shchi-fresh-cabbage-with-potatoes": -1,
    "shchi-sauerkraut": -1,
    "solyanka-meat": 0,
    "solyanka-fish": -1,
    "rassolnik": -1,
    "rassolnik-no-potatoes": -1,
    "mushroom-soup-with-potatoes": 2,
    "pea-soup-smoked": 2,
    "ukha": 0,
    "cheese-soup": 2,
    "kharcho": 2,
    "kharcho-no-rice": 2,
    "pumpkin-soup": -2,
    "pumpkin-cream-soup": -2,
    "vegetable-puree-soup": 2,
    "mushroom-cream-soup-base": 2,
    "mushroom-cream-soup": 2,
    "ramen-assembled": 2,
    "pho-assembled": 2,
    "miso-soup": -2,
    "tonjiru": -2,
    "tom-yum-broth": 2,
    "tom-yum-shrimp": 2,
    "sundubu-jjigae": -2,
    "okroshka-kvass": 0,
    "meatballs-tomato-sauce": 0,
    "tefteli": 0,
    "chili-con-carne": -1,
    "taco-meat": 1,
    "beef-goulash-no-potatoes": 0,
    "beef-goulash-with-potatoes": 0,
    "beef-bourguignon": -1,
    "braised-short-ribs": 2,
    "joues-de-boeuf": 2,
    "tripe-stew": -2,
    "pieds-paquets": -2,
    "tongue-in-sauce": -2,
    "kidneys-madeira": -2,
    "boeuf-stroganoff-sour-cream": 2,
    "boeuf-stroganoff-no-sour-cream": 2,
    "liver-sour-cream": -2,
    "chicken-creamy-mushroom": 0,
    "chakhokhbili": -1,
    "kuchmachi": -2,
    "zharkoe-v-gorshochkakh": 0,
    "chicken-tikka-masala": -1,
    "dal": -1,
    "bhindi-masala": -1,
    "thai-green-curry": -1,
    "lamb-tagine-prunes": -1,
    "gambas-al-ajillo": 0,
    "shakshuka-sauce": 0,
    "shakshuka-with-eggs": 0,
    "plov": 1,
    "paella-seafood": 2,
    "risotto": 1,
    "sweet-sour-pork-battered": 2,
    "mapo-tofu": -2,
    "lasagna-assembled-unbaked": 1,
    "lasagna-baked": 1,
    "moussaka": 0,
    "myaso-po-frantsuzski": 0,
    "omelette": 2,
    "pizza-raw-assembled": 2,
    "pizza-par-baked": 2,
    "pizza-baked": 2,
    "pizza-al-taglio-baked": 2,
    "pizza-neapolitan-baked": 2,
    "pirozhki-raw": 2,
    "pirozhki-baked": 2,
    "pirozhki-fried": 2,
    "khachapuri-imeruli": 2,
    "khachapuri-imeruli-raw": 2,
    "khachapuri-adjaruli": 2,
    "pelmeni-raw": -1,
    "pelmeni-boiled": -1,
    "leberknoedel": -2,
    "khinkali-raw": 0,
    "khinkali-boiled": 0,
    "gyoza-raw": -1,
    "gyoza-cooked": -1,
    "kotlety-raw": 2,
    "kotlety-fried": 2,
    "liver-fritters": -2,
    "liver-cake": -2,
    "fish-cakes-raw": -1,
    "fish-cakes-fried": -1,
    "burger-patties-raw": 2,
    "burger-patties-cooked": 2,
    "schnitzel-raw-breaded": 2,
    "schnitzel-fried": 2,
    "falafel-raw": -1,
    "falafel-fried": -1,
    "golubtsy-raw": 0,
    "golubtsy-cooked": 0,
    "gapama": -2,
    "blinchiki-meat": 0,
    "syrniki-raw": 0,
    "syrniki-fried": 0,
    "sandwich-ham-cheese": 2,
    "burger-assembled": 2,
    "tacos-assembled": 1,
    "shawarma": 2,
    "sushi-maki": 2,
    "inari-sushi": -2,
    "mashed-potatoes": 2,
    "mashed-potatoes-rich": 2,
    "mashed-potatoes-lean": 2,
    "french-fries-par-fried": 2,
    "french-fries-fully-fried": 2,
    "potato-wedges-parcooked": 2,
    "roasted-potatoes-cooked": 2,
    "potatoes-pan-fried": 2,
    "butternut-puree": -2,
    "squash-roasted-cubes": -2,
    "red-cabbage-braised": -1,
    "sauerkraut-braised": -1,
    "cabbage-braised": -1,
    "grilled-pepper-eggplant": 2,
    "olivier-dressed": -1,
    "vinegret": 2,
    "herring-under-fur-coat": 2,
    "tabbouleh": -1,
    "coleslaw-mayo": 1,
    "korean-carrot": 0,
    "cucumber-salad": 2,
    "greek-salad": 2,
    "caesar-salad": 2,
    "grilled-vegetables-marinated": 2,
    "chopped-liver": -2,
    "ceviche": 0,
    "beef-tartare": 2,
    "ragu-bolognese": 2,
    "miso": -2,
    "rice-white-long-grain-cooked": 2,
    "rice-parboiled-cooked": 2,
    "rice-basmati-cooked": 2,
    "rice-jasmine-cooked": 2,
    "buckwheat-cooked": 0,
    "oat-porridge-rolled": 0,
    "semolina-porridge": 0,
    "pasta-in-tomato-sauce": 2,
    "makarony-po-flotski": 2,
    "pasta-in-cream-sauce": 2,
    "tofu-firm-raw": -2,
    "tofu-firm-frozen-for-texture": -2,
    "tofu-fried": -2,
    "tofu-silken": -2,
    "natto": -1,
    "tofu-smoked-marinated": -2,
    "yuba-fresh": -2,
    "blini-thin": 2,
    "cake-medovik": 2,
    "pumpkin-roll": -2,
    "cake-chocolate-ganache": 2,
    "cake-napoleon": 2,
    "cheesecake-baked": 2,
    "cheesecake-basque": 2,
    "cheesecake-no-bake": 2,
    "tiramisu": 2,
    "mousse-chocolate": 1,
    "chocolate-fondant-raw": 1,
    "chocolate-fondant-baked": 1,
    "panna-cotta": 1,
    "brownies": 2,
    "appeltaart": 2,
    "pie-pecan": 1,
    "pie-pumpkin": -2,
    "strudel-raw": 2,
    "strudel-baked": 2,
    "sharlotka": 2,
    "baklava": -1,
    "ice-cream-store": 2,
    "ice-cream-cone": 2,
    "ice-cream-homemade": 2,
    "gelato": 2,
    "chocolate-bar": 1,
    "halva": -1,
    "turkish-delight": 1,
    "brussels-sprouts-raw": -2,
    "brussels-sprouts-blanched": -2,
    "brussels-sprouts-roasted": -2,
    "broccoli-cooked": 1,
    "pumpkin-raw": -2,
    "butternut-raw": -2,
    "pumpkin-roasted": -2,
    "pumpkin-puree": -2,
    "spaghetti-squash-cooked": -2,
    "roasted-vegetables-mediterranean": 2,
    "lettuce-iceberg": 1,
    "rucola": 1,
    "edamame-blanched": -2,
    "okra-raw": -1,
    "okra-blanched": -1,
    "nameko": -1,
    "slippery-jack-boiled": -1,
    "mozuku": -1,
    "beef-steak-vacuum": 2,
    "beef-steak-wrapped": 2,
    "beef-steak-thin": 2,
    "beef-steak-dry-aged": 2,
    "beef-short-ribs": 2,
    "veal-escalope": 2,
    "pork-chop": 2,
    "pork-neck-shoulder": -1,
    "pork-ribs-raw": 2,
    "liver-red": -2,
    "heart": -2,
    "tongue-raw": -2,
    "kidneys": -2,
    "tripe": -2,
    "shashlik-marinated": 2,
    "anticuchos-marinated": -2,
    "chicken-breast": -1,
    "chicken-wings": 2,
    "chicken-liver": -2,
    "chicken-hearts-gizzards": -2,
    "turkey-giblets": -2,
    "duck-goose-giblets": -2,
    "poultry-stuffed-raw": 0,
    "steak-cooked": 2,
    "liver-filling": -2,
    "tongue-boiled": -2,
    "kebab-meat-cooked": 1,
    "ribs-cooked": 2,
    "shashlik-cooked": 2,
    "roast-chicken-whole": 2,
    "roast-chicken-legs": -1,
    "chicken-wings-cooked": 2,
    "duck-goose-roast": 0,
    "duck-breast-cooked": -1,
    "gesiers-confits": -2,
    "liver-fried": -2,
    "bacon-cooked": 1,
    "salo-salted": -2,
    "salo-smoked": -1,
    "salo-fresh": -2,
    "salo-spread": -2,
    "lardo": -2,
    "smoked-duck-breast": 1,
    "andouillette": -2,
    "balkenbrij": -2,
    "sausage-raw-pork": 1,
    "liver-pate-chicken": -2,
    "liverwurst": -2,
    "foie-gras-raw": 1,
    "foie-gras-terrine": -1,
    "kholodets": 0,
    "kibbeling-raw": 2,
    "fish-breaded-raw": 1,